State/Territory,Solar and Battery Systems,Empowering Homes Program (NSW),Historical,"Interest-free loans to eligible NSW homeowners for installing solar battery systems. $14,000 towards a solar PV and battery system (repayable over a range of terms up to 8 years), or $9,000 towards retrofitting a battery to an existing solar power system (repayable over a range of terms up to 10 years). Other eligibility criteria included a household income of no more than $180,000 per annum, and owner-occupier. Never went past pilot mode.",Home owners,Loans,"$14,000 for solar PV and battery, $9,000 for battery retrofit","The Smart Distributed Batteries project is being deployed in the following Council areas:

Shoalhaven City Council
Eurobodalla Shire Council
Bega Valley Shire Council
Queanbeyan-Palerang Regional Council
Yass Valley Council (within 100km of Canberra CBD)
Snowy Monaro Council (within 100km of Canberra CBD)
Goulburn Mulwaree Council (within 100km of Canberra CBD)
If you own a home or a business in one of those regions, you are eligible for the SDB discount. 

Must be an owner-occupier in NSW with a household income of no more than $180,000 per annum.",Unsure ,Program did not go beyond pilot mode,NSW Government Department of Planning and Environment,"Designed to increase the adoption of solar PV and battery systems.

Aimed to reduce household energy costs and support renewable energy targets.

Pilot mode feedback may have influenced future programs.",,"Website: https://www.energy.nsw.gov.au

General Enquiries: 1300 136 888 (NSW Government Energy Information Line)","https://www.nsw.gov.au/news/interest-free-loans-for-home-battery-systems#:~:text=The%20Empowering%20Homes%20Program%20will,battery%20system%20will%20be%20available."
State/Territory,Solar and Battery Systems,Rebate Swap for Solar (NSW) ,Historical,"Rebate Solar Swap – this program is aimed at helping low-income households access the benefits of solar energy. It involved the installation of free solar systems on the homes of eligible participants to reduce their electricity bills. Eligible homeowners can get a free 3 kilowatt solar system installed on their home. 

Shower heads discounts come under this - Victorian households and businesses upgrading their conventional shower head to a water-saving one may be entitled to a discount (see link). ",Low-income households in NSW,Finacial - free and discount ,N/A,N/A,N/A,N/A,NSW Government Department of Planning and Environment,"Reduced energy costs for low-income households.

Increased access to solar energy for disadvantaged communities.",,"Website: https://www.energy.nsw.gov.au

General Enquiries: 1300 136 888 (NSW Government Energy Information Line)",https://www.energy.nsw.gov.au/households/rebates-grants-and-schemes/rebate-swap-solar-offer
State/Territory,Financial Incentives,Victorian Energy Upgrades (VIC) ,Current,"The VEU program, formerly known as the Victorian Energy Efficiency Target (VEET) scheme, offers incentives for households to upgrade their lighting, heating, and cooling systems to more energy-efficient options. This program provides discounts on energy-efficient appliances and installations. Must install an approved product and work with an accredit provider to gain the discount. Available to renters. Started in 2009 and is still operational. ","Victorian households and small businesses, including renters, looking to reduce energy use and costs by upgrading to energy-efficient products and systems.",discounts and rebates,"Depends on the product

incentives are based on the number of Victorian Energy Efficiency Certificates (VEECs) generated, which is tied to energy savings.","- Must operate/reside in Victoria
- Products, installations and technologies must meet eligibility and evidence requirements.
- Participating lender will have further eligibility criteria depending on the financial product.",2009 (under the original Victorian Energy Efficiency Target scheme),Ongoing (subject to policy changes),"Victorian Government Department of Energy, Environment and Climate Action","Reduction in household and business energy costs.

Lower greenhouse gas emissions across Victoria.

Increased adoption of energy-efficient technologies.

Significant energy savings for participants, contributing to state-wide climate goals.","Formerly known as the Victorian Energy Efficiency Target (VEET) scheme, the program has evolved to cover a broader range of products and services.","DEECA general enquiries: 136 186

Victorian Energy Upgrades team (03) 9032 1310

Email: energy.upgrades@deeca.vic.gov.au","https://www.solar.vic.gov.au/solar-homes-program

https://www.energy.vic.gov.au/victorian-energy-upgrades/products/shower-head-discounts"
State/Territory,"Solar and Battery Systems, Hot Water System Upgrades",Solar Homes Program (VIC),Current,"The Solar Homes Program offers eligible Victorian households solar panel (PV) rebates and the option of an interest-free loan, hot water rebates, and an interest-free loan for solar batteries.
","Victorian households, including homeowners and renters, seeking to install solar panels, batteries, or hot water systems to reduce energy costs and emissions.","Financial incentives, including rebates and interest-free loans",Expanded below ,Expanded below ,Aug 2018,Expanded below ,"Solar Victoria (Solar Vic), a portfolio entity within Department of Environment, Land, Water and Planning (DELWP).","Helps Victorian households reduce energy costs and transition to renewable energy.

Contributes to Victoria’s renewable energy and emissions reduction targets.

Improves energy independence and decreases reliance on grid electricity.","The program covers multiple initiatives, including solar PV rebates, battery rebates, and hot water rebates.

Rebates are subject to annual funding caps, and applications are reviewed on a first-come, first-served basis.","1300 376 393
enquiries@team.solar.vic.gov.au",https://www.solar.vic.gov.au/solar-homes-program
State/Territory,Solar and Battery Systems,Solar Battery Loans Program (under Solar Homes Program) (VIC),Current,"An interest-free loan of up to $8,800 for the installation of a solar battery system. This reduces the upfront cost and is repaid monthly over 4 years.","Homeowners looking to install solar panels, batteries, or hot water systems.
Renters (with landlord approval) seeking energy cost reductions through solar installations.
Low- to middle-income households meeting the program's income and property value criteria.",loan," interest-free loan of up to $8,800 for the installation of a solar battery system. ","As a Victorian householder, you could be eligible for a solar battery loan if:
you are the owner-occupier of an existing property where the system is to be installed
combined household taxable income of all owners is less than $210,000 per year
value of the property is under $3 million
address has not previously received a solar battery rebate
solar panel system with an inverter capacity equal to or greater than 5kW is installed on the property, or will be installed with the solar battery
property does not have an existing energy storage system
energy storage solution proposed has a capacity of at least 6kWh and is listed on our battery product list
pre-approval to connect a battery to the grid is organised from your Distributed Network Service Provider (DNSP)
owner/s agree to receive information from the DNSP about taking part in battery trials to maximise the value to household of having one.
Battery storage may not be suitable for all households, budgets and circumstances. Check if a battery will suit you.
The solar battery loan is not available to homes under construction.",Aug 2018,till exhausted (as of 25 October 2024 1032 loans remain available) ,"Solar Victoria (Solar Vic), a portfolio entity within Department of Environment, Land, Water and Planning (DELWP).","Helps Victorian households reduce energy costs and transition to renewable energy.

Contributes to Victoria’s renewable energy and emissions reduction targets.

Improves energy independence and decreases reliance on grid electricity.",,"1300 376 393
enquiries@team.solar.vic.gov.au",https://www.solar.vic.gov.au/solar-battery-loan
State/Territory,Solar and Battery Systems,Solar Panel (PV) Rebate (under Solar Homes Program) (VIC),Current,"The Solar Panel (PV) Rebate is part of the Solar Homes Program in Victoria, offering eligible households a rebate of up to $1,400 to install solar PV systems. This initiative aims to help reduce energy bills, increase renewable energy adoption, and contribute to the state’s climate action goals. Homeowners can also access an interest-free loan matching the rebate amount.","Victorian homeowners, including owner-occupiers of existing properties or homes under construction, who meet the program’s income and property value criteria.",rebate,"rebate of up to $1,400 for the installation of solar panel (PV) systems. ","As a Victorian householder, you could receive a solar panel (PV) rebate if:
you are the owner-occupier of an existing property or the owner of a home under construction where the system is to be installed
combined household taxable income of all owners is less than $210,000 per year
value of the property is under $3 million (for an existing home or when construction is complete)
property address has not previously received a solar panel (PV) or solar battery rebate under this program
the property address has not had a solar panel (PV) system installed in the last 10 years
you received a Solar Homes rebate and/or loan but have moved house. You can apply for another incentive at your new address as an owner-occupier if the property has not received these rebates before.
must use an authorised solar retailer and use only eligible products.
",Aug 2018,till exhausted (as of 18 November 2024 1907 rebates remain available),"Solar Victoria (Solar Vic), a portfolio entity within Department of Environment, Land, Water and Planning (DELWP).","Helps Victorian households reduce energy costs and transition to renewable energy.

Contributes to Victoria’s renewable energy and emissions reduction targets.

Improves energy independence and decreases reliance on grid electricity.",,"1300 376 393
enquiries@team.solar.vic.gov.au",https://www.solar.vic.gov.au/solar-panel-rebate
State/Territory,Hot Water System Upgrades,Hot water rebate (under Solar Homes Program) (VIC),Current,"The Solar Homes hot water rebate aid Victorian families with the cost of installing hot water systems. The hot water rebate is up to $1000 to assist with the purchase of an eligible heat pump or solar hot water system.

Not-for-profit community housing providers are also eligible to apply for the rebate on behalf of their tenants.",Victorian Householders,rebate,depends on product and retailer,"As a Victorian householder, you could receive a hot water rebate if:
you are the owner-occupier of an existing property where the system is to be installed
the household taxable income of all owners combined is less than $210,000 per year
the value of the property is under $3 million
the property address has not already received a hot water or a solar battery rebate under the Solar Homes Program
the hot water system to be replaced is at least 3 years old from the date of purchase
you received a Solar Homes rebate and/or loan but have moved house. You can apply for another incentive at your new address as an owner-occupier if the property has not received these rebates before.
You must work with an authorised hot water retailer and use only eligible products.",Aug 2018,till exhausted (as of 19 November 2024 771 rebates remain available),"Solar Victoria (Solar Vic), a portfolio entity within Department of Environment, Land, Water and Planning (DELWP).","Helps Victorian households reduce energy costs and transition to renewable energy.

Contributes to Victoria’s renewable energy and emissions reduction targets.

Improves energy independence and decreases reliance on grid electricity.",,"1300 376 393
enquiries@team.solar.vic.gov.au",https://www.solar.vic.gov.au/hot-water-rebate
State/Territory,Solar and Battery Systems,Solar rebates for rental properties (under Solar Homes Program) (VIC),Current,"The solar panel (PV) rebate supports Victorian homeowners and landlords in adopting solar PV systems.

Victorians meeting the eligibility criteria can access rebates of up to $1,400 for solar panel installations on existing homes, properties under construction, and rental properties. Additionally, they may apply for an interest-free loan matching the rebate amount.

Those who have relocated after receiving a rebate for a previous property are still eligible to reapply.",Victorian homeowners and landlords,rebate,"rebate of up to $1,400 to eligible rental providers for the installation of solar panel (PV) systems on a maximum of two rental properties each financial year. ","As a Victorian rental provider, you could receive a rebate for your rental property if:
your renters have a combined household taxable income of less than $210,000 per year
you have not received more than two rebates for a rental property during the current financial year
value of the property is under $3 million
property address has not previously received a solar panel (PV) rebate or a solar battery rebate under the Solar Homes Program
a Solar Homes Program Agreement has been signed by you and your renter(s)
you received a hot water rebate as an owner-occupier and have rented the same property to a tenant, you can apply for the solar PV rental rebate as a rental provider (2 per financial year still applies)
you received a solar battery loan as an owner-occupier and have become a rental provider of the same property. You can get a solar PV rental rebate as a rental provider if your solar PV system is older than 10 years.

You must use an authorised solar retailer and use only eligible products.
",Aug 2018,till exhausted (as of 18 November 2024 1739 rebates remain available),"Solar Victoria (Solar Vic), a portfolio entity within Department of Environment, Land, Water and Planning (DELWP).","Helps Victorian households reduce energy costs and transition to renewable energy.

Contributes to Victoria’s renewable energy and emissions reduction targets.

Improves energy independence and decreases reliance on grid electricity.",,"1300 376 393
enquiries@team.solar.vic.gov.au",https://www.solar.vic.gov.au/solar-rebates-rental-properties
State/Territory,Solar and Battery Systems,Solar rebates for community housing (under Solar Homes Program) (VIC),Current,Not-for-profit community housing organisations (CHO) can apply for a rebate of up to $1400 per tenancy on behalf of their renters to install solar panels (PV) on the properties they manage. ,"Not-for-profit community housing organisations 
Tenants of community housing properties",rebate,"up to $1,400 or a maximum of 50 per cent of the costs of the solar panel (PV) installation per individual residential rental agreement. For example, if the net costs of the installation are $2,000, the rebate value applied is $1,000 (not $1,400).","A not-for-profit organisation that provides affordable rental housing to low-income households is eligible to receive a solar panel (PV) rebate if it:
is a Registered CHO listed on the Housing Registrar Public Register as a community housing provider; OR
is registered with the Australian Charities and Not-for-Profits Commission; and
can demonstrate that the provision of affordable housing is one of the organisation’s core activities
has properties that are owned or managed by the community housing organisation
confirms that the full value (100%) of energy savings achieved by installing solar panels will be passed onto renters
engages an authorised solar retailer who must use products on our product lists.",Aug 2018,Unsure ,"Solar Victoria (Solar Vic), a portfolio entity within Department of Environment, Land, Water and Planning (DELWP).","Helps Victorian households reduce energy costs and transition to renewable energy.

Contributes to Victoria’s renewable energy and emissions reduction targets.

Improves energy independence and decreases reliance on grid electricity.",,CHO@team.solar.vic.gov.au,https://www.solar.vic.gov.au/solar-community-housing
State/Territory,Solar and Battery Systems,Solar for Apartments (VIC),Current,"The Solar for Apartments program supports owners and residents through lower upfront costs for the installation of solar PV. 

Successful applicants will receive funding of up to $2,800 per apartment, or up to $140,000 for buildings of up to 50 apartments to install solar panels on their rooftop. 

The program is a joint initiative between the Australian and Victorian governments. 
","Apartment owners and residents in Victoria, including building managers for larger installations",rebate/grant,"$2,800 per apartment or up to $140,000 per property","Owners Corporation (OC) Eligibility:
Must consist of 3 to 50 occupiable lots (tier three or four OCs under the Owners Corporations Act 2006).
Must not have previously received funding under the Solar for Apartments Program.
Ineligible entities include individuals, government agencies, private sector businesses, educational institutions, not-for-profits, and local councils.
Building Eligibility:
Maximum 8 storeys tall from ground level.
Must be a completed development classified as:
Class 2 domestic buildings (e.g., apartments), or
Horizontally attached Class 1a buildings (e.g., townhouses).
Median residential lot value must not exceed $950,000.
No solar PV system installed in the last 10 years unless for non-connected residential lots.
Located in Victoria and not connected to an embedded electricity network.
Exclusions: retirement villages, commercial buildings, council-owned properties, or developments owned by property developers or community housing organizations.
System Eligibility:
Must supply power to 5-50 residential lots and have a payback period within 10 years.
Costs and savings must be shared equitably among residents.
Systems must:
Be installed on common property roofs.
Supply power directly to residential lots or shared areas under specific conditions.
Use products and installers authorized by Solar Victoria.
Have approval from the Distributed Network Service Provider for grid connection and export.
Ineligible Systems:
Systems installed via Power Purchase Agreements.
Systems solely providing energy to common areas.
Systems for lots with solar installed in the past 10 years.
Systems already installed before application.","opened applications on February 13, 2024","Friday 6 December 2024, or until all rebates are exhausted, whichever comes first.","Solar Victoria (Solar Vic), a portfolio entity within Department of Environment, Land, Water and Planning (DELWP).","Helps Victorian households reduce energy costs and transition to renewable energy.

Contributes to Victoria’s renewable energy and emissions reduction targets.

Improves energy independence and decreases reliance on grid electricity.",,sfa@team.solar.vic.gov.au,https://www.solar.vic.gov.au/apartments
State/Territory,Education and Awareness Programs,Energy Assistance Program (VIC) ,Current,"The Energy Assistance Program is a free phone-based service aimed at helping Victorians struggling to pay their energy bills. 

The program provides personalised, one-on-one support to help participants apply for concessions and grants, access retailer hardship programs, compare and switch energy offers, and address billing issues. Additionally, the program offers energy-saving tips, efficiency advice, and referrals to services such as financial counseling. Tailored assistance is available for contacting energy retailers and other support services on the participant's behalf.

Delivered in partnership with Anglicare Victoria, the program empowers consumers by enhancing their understanding of their rights and options within the energy market.
","Victorian households, particularly those struggling to pay energy bills, including concession holders and those experiencing financial hardship.",Support service,N/A,"hold a Commonwealth Government Concession card; or
be struggling or expecting to struggle to pay your energy bill.",Feb 2023,Ongoing (subject to policy changes),"Anglicare Victoria, in partnership with the Victorian Government","Enhanced understanding of energy rights and available support.

Increased access to concessions, grants, and tailored assistance.

Assistance with energy-saving tips and financial counseling.",,"Anglicare Victoria

1800 531 741

speak to an energy advocate - 1800 161 215",https://www.energy.vic.gov.au/households/help-paying-your-energy-bills/energy-assistance-program
State/Territory,Solar and Battery Systems,Solar Feed-in Tariff (VIC),Historical,"In Victoria, the feed-in tariff program compensates small-scale renewable energy producers, such as households with solar PV or wind systems, for excess electricity they generate and export to the grid. The tariff rates vary by retailer, and consumers can compare these rates using the Victorian Energy Compare website.
","Victorian households and small-scale renewable energy producers, such as those with solar PV or wind systems.",Financial incentive (tariff payment for exported energy),Tariff rates vary by retailer and system size,"Must be a Victorian resident with a small-scale renewable energy system (solar PV or wind).
The system must comply with the relevant safety and performance standards.
Must be connected to the grid and capable of exporting electricity.",2009,Solar Premium feed-in tariff ended 1 Nov 2024,"Victorian Government, overseen by the Essential Services Commission.

DEECA","Encourages the adoption of renewable energy.

Supports households in reducing electricity bills and offsetting energy costs.

Contributes to Victoria's renewable energy and emissions reduction targets.",,DEECA general enquiries: 136 186,https://www.energy.vic.gov.au/households/solar-premium-feed-in-tariff
State/Territory,Heating and Cooling Upgrades,PeakSmart Air Conditioning (gov funded) (QLD),Current,"The Energex PeakSmart air conditioning rewards program provides south-east Queenslanders with incentives of up to $400 for purchasing a PeakSmart air conditioner or converting an existing one. Incentives differ depending on which category you belong to.

Energex (Opens in new window)  (South East Queensland) and Ergon Energy (Opens in new window)  (regional Queensland) are offering up to $400 cash back through the PeakSmart program if you replace your old air conditioner with a PeakSmart-compatible model.

PeakSmart air-conditioning helps reduce peak demand by dropping your air conditioner into a lower performance mode (like an economy mode) when the network is under stress, which only occurs a few times a year.

The technology is designed to be 'set and forget', so once you’ve signed up to the PeakSmart program, you won't have to do anything. 
",South-east Queenslanders and regional Queenslanders who are Energex or Ergon Energy customers.,cashback,Up to $400,"Must be a customer of Energex (South East Queensland) or Ergon Energy (regional Queensland).
Must purchase or convert an air conditioner to a PeakSmart-compatible model.
The air conditioner must meet eligibility requirements as listed on the program's website.",1 Jan 2018 (but unsure),Unsure ,"Energex and Ergon Energy, both subsidiaries of Energy Queensland.","Reduces energy demand during peak periods by placing air conditioners in ""economy mode.""
Helps stabilise the electricity grid and lowers the risk of blackouts during high-demand times.",,"Energex General Enquiries 13 12 53

Ergon Energy General Enquiries 13 74 66","https://www.qld.gov.au/housing/home-modifications-energy-savings/your-home#:~:text=Air%2Dconditioning%20rewards,t%20have%20to%20do%20anything.

https://www.energex.com.au/manage-your-energy/cashback-rewards-program/peaksmart-air-conditioning

https://www.ergon.com.au/network/manage-your-energy/cashback-rewards-program/peaksmart-air-conditioning"
State/Territory,Solar and Battery Systems,Australian battery supply chain database (QLD),Current,"Queensland launched Australia's first Battery Supply Chain Database, which provides valuable information which may be relevant for homeowners considering or already using battery storage systems. This resource can help homeowners make informed decisions about battery storage, from purchase and installation to maintenance and eventual recycling. It includes information such as, integration services and maintenance, re-use and recycling and equipment suppliers
","Battery manufacturers, supply chain stakeholders, homeowners, and businesses considering or using battery storage systems.",Informational resource and industry support.,N/A,"Open to stakeholders in the battery supply chain, including manufacturers, suppliers, and end-users of battery storage systems.",2 July 2024,Ongoing (subject to policy changes),"Queensland Government, in partnership with the Australian Government Department of Industry
Science and Resources (DISR) and a consortium of Queensland universities","Supports growth and development of Queensland’s battery supply chain.
Facilitates informed decision-making on battery storage use, maintenance, and recycling.
Enhances collaboration between stakeholders and boosts Queensland’s renewable energy sector.",,"Queensland Department of State Development and Infrastructure on (07) 3452 7100.

Ph: 13QGOV (13 74 68)
statedevelopment.qld.gov.au
info@dsdilgp.qld.gov.au","https://www.rdmw.qld.gov.au/manufacturing/strategy/australian-battery-supply-chain-database

https://gateway.icn.org.au/battery"
